{
  "schemaVersion": 1,
  "revision": "runtime-promotion-d90b7e86bd264ffa",
  "releaseId": "development",
  "languages": [
    {
      "id": "csharp",
      "displayName": "C#",
      "monacoLanguageId": "csharp",
      "extensions": [
        ".cs"
      ],
      "defaultFileName": "Program.cs",
      "defaultSource": "using System;\n\nConsole.WriteLine(\"Hello from SharpLabNext\");\n",
      "defaultToolchainId": "roslyn-main",
      "capabilities": [
        "diagnostics",
        "completion",
        "hover",
        "signature-help",
        "code-actions",
        "semantic-tokens",
        "ast",
        "explain",
        "multi-file"
      ],
      "legacyAliases": [
        "cs"
      ]
    },
    {
      "id": "visual-basic",
      "displayName": "Visual Basic",
      "monacoLanguageId": "vb",
      "extensions": [
        ".vb"
      ],
      "defaultFileName": "Program.vb",
      "defaultSource": "Imports System\n\nModule Program\n    Sub Main()\n        Console.WriteLine(\"Hello from SharpLabNext\")\n    End Sub\nEnd Module\n",
      "defaultToolchainId": "roslyn-stable",
      "capabilities": [
        "diagnostics",
        "completion",
        "hover",
        "signature-help",
        "code-actions",
        "semantic-tokens",
        "ast",
        "multi-file"
      ],
      "legacyAliases": [
        "vb"
      ]
    },
    {
      "id": "fsharp",
      "displayName": "F#",
      "monacoLanguageId": "fsharp",
      "extensions": [
        ".fs",
        ".fsx"
      ],
      "defaultFileName": "Program.fs",
      "defaultSource": "open System\n\nprintfn \"Hello from SharpLabNext\"\n",
      "defaultToolchainId": "fsharp-stable",
      "capabilities": [
        "diagnostics",
        "completion",
        "hover",
        "signature-help",
        "semantic-tokens",
        "ast",
        "multi-file",
        "source-order"
      ],
      "legacyAliases": [
        "fs"
      ]
    },
    {
      "id": "gsharp",
      "displayName": "G#",
      "monacoLanguageId": "gsharp",
      "extensions": [
        ".gs"
      ],
      "defaultFileName": "Program.gs",
      "defaultSource": "package SharpLab\n\nimport System\n\nConsole.WriteLine(\"Hello from G#\")\n",
      "defaultToolchainId": "gsharp-stable",
      "capabilities": [
        "diagnostics",
        "completion",
        "hover",
        "signature-help",
        "code-actions",
        "semantic-tokens",
        "document-symbols",
        "folding-ranges",
        "multi-file"
      ],
      "legacyAliases": [
        "gs"
      ]
    },
    {
      "id": "php",
      "displayName": "PHP",
      "monacoLanguageId": "php",
      "extensions": [
        ".php"
      ],
      "defaultFileName": "index.php",
      "defaultSource": "<?php\n\nfunction square(int $value): int\n{\n    return $value * $value;\n}\n\necho square(7), PHP_EOL;\n",
      "defaultToolchainId": "peachpie-stable",
      "capabilities": [
        "diagnostics",
        "multi-file"
      ],
      "legacyAliases": [
        "php"
      ]
    },
    {
      "id": "cppcli",
      "displayName": "C++/CLI",
      "monacoLanguageId": "cpp",
      "extensions": [
        ".cpp",
        ".cc",
        ".cxx"
      ],
      "defaultFileName": "Program.cpp",
      "defaultSource": "using namespace System;\n\nint main(array<String^>^)\n{\n    Console::WriteLine(\"Hello from C++/CLI\");\n    return 0;\n}\n",
      "defaultToolchainId": "msvc-cppcli-netfx48",
      "capabilities": [
        "diagnostics"
      ],
      "legacyAliases": [
        "cpp-cli"
      ]
    },
    {
      "id": "jsharp",
      "displayName": "J#",
      "monacoLanguageId": "java",
      "extensions": [
        ".jsl"
      ],
      "defaultFileName": "Program.jsl",
      "defaultSource": "public class Program\n{\n    public static void main(String[] args)\n    {\n        System.Console.WriteLine(\"Hello from J#\");\n    }\n}\n",
      "defaultToolchainId": "vjc-jsharp20",
      "capabilities": [
        "diagnostics"
      ]
    },
    {
      "id": "il",
      "displayName": "IL",
      "monacoLanguageId": "il",
      "extensions": [
        ".il"
      ],
      "defaultFileName": "Program.il",
      "defaultSource": ".assembly SharpLabNext.User {}\n.class public auto ansi Program extends [System.Runtime]System.Object\n{\n  .method public static void Main() cil managed\n  {\n    .entrypoint\n    .maxstack 1\n    ldstr \"Hello from SharpLabNext\"\n    call void [System.Console]System.Console::WriteLine(string)\n    ret\n  }\n}\n",
      "defaultToolchainId": "mobius-ilasm-stable",
      "capabilities": [
        "diagnostics",
        "completion",
        "hover",
        "signature-help",
        "code-actions",
        "semantic-tokens",
        "document-symbols",
        "folding-ranges",
        "multi-file"
      ],
      "legacyAliases": [
        "il"
      ]
    },
    {
      "id": "minilang",
      "displayName": "MiniLang",
      "monacoLanguageId": "minilang",
      "extensions": [
        ".mini"
      ],
      "defaultFileName": "Program.mini",
      "defaultSource": "print \"Hello from a third-party language\"\n",
      "defaultToolchainId": "minilang-stable",
      "capabilities": [
        "diagnostics",
        "completion",
        "multi-file"
      ]
    }
  ],
  "toolchains": [
    {
      "id": "roslyn-stable",
      "displayName": "Roslyn Stable 5.6.0",
      "workerId": "roslyn-stable",
      "releaseTrack": "stable",
      "resolvedVersion": "5.6.0",
      "defaultReferenceSetId": "net10-ref",
      "supportedLanguageIds": [
        "csharp",
        "visual-basic"
      ],
      "allowedReferenceSetIds": [
        "netcoreapp2.0-ref",
        "netcoreapp2.1-ref",
        "netcoreapp2.2-ref",
        "netcoreapp3.0-ref",
        "netcoreapp3.1-ref",
        "net5-ref",
        "net6-ref",
        "net7-ref",
        "net8-ref",
        "net9-ref",
        "net10-ref",
        "net11-preview-ref"
      ],
      "producesArtifactFormats": [
        "dotnet-managed-pe-v1"
      ],
      "capabilities": [
        "lsp",
        "compile-check",
        "managed-pe",
        "portable-pdb",
        "ast",
        "explain",
        "multi-file"
      ],
      "metadataFeatureTags": [],
      "legacyAliases": [
        "main"
      ],
      "availability": {
        "installed": true,
        "health": "healthy"
      }
    },
    {
      "id": "roslyn-stable-netfx48",
      "displayName": "Roslyn Stable 5.6.0 / .NET Framework",
      "workerId": "roslyn-stable-netfx48",
      "releaseTrack": "stable",
      "resolvedVersion": "5.6.0",
      "defaultReferenceSetId": "netfx48-managed-ref",
      "supportedLanguageIds": [
        "csharp",
        "visual-basic"
      ],
      "allowedReferenceSetIds": [
        "netfx20-managed-ref",
        "netfx30-managed-ref",
        "netfx35-managed-ref",
        "netfx40-managed-ref",
        "netfx45-managed-ref",
        "netfx451-managed-ref",
        "netfx452-managed-ref",
        "netfx46-managed-ref",
        "netfx461-managed-ref",
        "netfx462-managed-ref",
        "netfx47-managed-ref",
        "netfx471-managed-ref",
        "netfx472-managed-ref",
        "netfx48-managed-ref"
      ],
      "producesArtifactFormats": [
        "dotnet-framework-managed-pe-v1"
      ],
      "capabilities": [
        "lsp",
        "compile-check",
        "managed-pe",
        "portable-pdb",
        "ast",
        "explain",
        "multi-file"
      ],
      "metadataFeatureTags": [],
      "availability": {
        "installed": true,
        "health": "healthy"
      }
    },
    {
      "id": "roslyn-main",
      "displayName": "Roslyn Main 5.10.0 (708c0a9669c6)",
      "workerId": "roslyn-main",
      "releaseTrack": "nightly",
      "resolvedVersion": "5.10.0",
      "defaultReferenceSetId": "net11-preview-ref",
      "supportedLanguageIds": [
        "csharp",
        "visual-basic"
      ],
      "allowedReferenceSetIds": [
        "netcoreapp2.0-ref",
        "netcoreapp2.1-ref",
        "netcoreapp2.2-ref",
        "netcoreapp3.0-ref",
        "netcoreapp3.1-ref",
        "net5-ref",
        "net6-ref",
        "net7-ref",
        "net8-ref",
        "net9-ref",
        "net10-ref",
        "net11-preview-ref"
      ],
      "producesArtifactFormats": [
        "dotnet-managed-pe-v1"
      ],
      "capabilities": [
        "lsp",
        "compile-check",
        "managed-pe",
        "portable-pdb",
        "ast",
        "explain",
        "multi-file"
      ],
      "metadataFeatureTags": [],
      "legacyAliases": [
        "roslyn-main"
      ],
      "availability": {
        "installed": true,
        "health": "healthy"
      }
    },
    {
      "id": "roslyn-const-generics",
      "displayName": "Const Generics Roslyn",
      "workerId": "roslyn-const-generics",
      "releaseTrack": "experimental",
      "resolvedVersion": "4.8.0-const-generics.bcd209abd947",
      "defaultReferenceSetId": "const-generics-ref",
      "supportedLanguageIds": [
        "csharp"
      ],
      "allowedReferenceSetIds": [
        "const-generics-ref"
      ],
      "producesArtifactFormats": [
        "dotnet-managed-pe-v1"
      ],
      "capabilities": [
        "lsp",
        "compile-check",
        "managed-pe",
        "portable-pdb",
        "ast",
        "explain",
        "multi-file"
      ],
      "metadataFeatureTags": [
        "metadata.const-generics.v1"
      ],
      "legacyAliases": [
        "const-generics"
      ],
      "availability": {
        "installed": true,
        "health": "healthy"
      }
    },
    {
      "id": "fsharp-stable",
      "displayName": "F# Stable 43.12.204",
      "workerId": "fsharp-stable",
      "releaseTrack": "stable",
      "resolvedVersion": "43.12.204",
      "defaultReferenceSetId": "net10-ref",
      "supportedLanguageIds": [
        "fsharp"
      ],
      "allowedReferenceSetIds": [
        "net10-ref",
        "net11-preview-ref"
      ],
      "producesArtifactFormats": [